{
  "id": "prov.daydream.session-time-left.1",
  "claim_type": "operation-mapping",
  "operation": "session.time_left",
  "api": "daydream",
  "status": "documented",
  "summary": "DreamDoor TimeLeft returns remaining caller time",
  "sources": [
    {
      "archive": "DayDreamBBSDev.lha",
      "path": "DayDream/Developer/DreamDoor/Doc/DreamDoor.doc",
      "symbol": "TimeLeft"
    },
    {
      "archive": "DayDreamBBSDev.lha",
      "path": "DayDream/Developer/DreamDoor/Doc/DreamDoor.fd",
      "symbol": "TimeLeft"
    }
  ]
}
