{
  "id": "prov.daydream.terminal-read-key.1",
  "claim_type": "operation-mapping",
  "operation": "terminal.read_key",
  "api": "daydream",
  "status": "documented",
  "summary": "DreamDoor DDGetKey reads a terminal key",
  "sources": [
    {
      "archive": "DayDreamBBSDev.lha",
      "path": "DayDream/Developer/DreamDoor/Doc/DreamDoor.doc",
      "symbol": "DDGetKey"
    },
    {
      "archive": "DayDreamBBSDev.lha",
      "path": "DayDream/Developer/DreamDoor/Doc/DreamDoor.fd",
      "symbol": "DDGetKey"
    },
    {
      "archive": "DayDreamBBSDev.lha",
      "path": "DayDream/Developer/DreamDoor/AmigaE/Example.e",
      "note": "Observed language-binding example."
    }
  ]
}
