{
  "id": "prov.daydream.terminal-read-line.1",
  "claim_type": "operation-mapping",
  "operation": "terminal.read_line",
  "api": "daydream",
  "status": "documented",
  "summary": "DreamDoor Prompt supplies line-oriented input behavior",
  "sources": [
    {
      "archive": "DayDreamBBSDev.lha",
      "path": "DayDream/Developer/DreamDoor/Doc/DreamDoor.doc",
      "symbol": "Prompt"
    },
    {
      "archive": "DayDreamBBSDev.lha",
      "path": "DayDream/Developer/DreamDoor/Sas_C/include/clib/dddoor_protos.h",
      "symbol": "Prompt"
    }
  ]
}
