{
  "id": "prov.daydream.terminal-write.1",
  "claim_type": "operation-mapping",
  "operation": "terminal.write",
  "api": "daydream",
  "status": "documented",
  "summary": "DreamDoor provides DDPutStr and DDPrintf for terminal output",
  "sources": [
    {
      "archive": "DayDreamBBSDev.lha",
      "path": "DayDream/Developer/DreamDoor/Doc/DreamDoor.doc",
      "symbol": "DDPutStr/DDPrintf"
    },
    {
      "archive": "DayDreamBBSDev.lha",
      "path": "DayDream/Developer/DreamDoor/Sas_C/include/clib/dddoor_protos.h",
      "symbol": "DDPutStr/DDPrintf"
    },
    {
      "archive": "DayDreamBBSDev.lha",
      "path": "DayDream/Developer/DreamDoor/Sas_C/Example/testlib.c",
      "note": "Observed SDK example usage."
    }
  ]
}
