{
  "id": "prov.paragon.lifecycle-exit.1",
  "claim_type": "operation-mapping",
  "operation": "lifecycle.exit",
  "api": "paragon",
  "status": "observed",
  "summary": "Command 20 performs normal door termination",
  "sources": [
    {
      "archive": "max_e.lha",
      "path": "MAXDoor.e",
      "symbol": "command 20"
    },
    {
      "archive": "CDoorExample.lha",
      "path": "door.c",
      "symbol": "command 20"
    },
    {
      "archive": "ArisDoors4MAXs.lha",
      "path": "arisdoors4maxs/view/View.c",
      "symbol": "command 20",
      "note": "Observed normal termination in historical source."
    }
  ]
}
