{
  "id": "prov.ambos.terminal-write.1",
  "claim_type": "operation-mapping",
  "operation": "terminal.write",
  "api": "ambos",
  "status": "documented",
  "summary": "AmBoS BBS library declares BBSWrite and BBSPrintf terminal output calls",
  "sources": [
    {
      "archive": "AmBoS_doc_dev.lha",
      "path": "Dokumentation/include/clib/BBS_protos.h",
      "symbol": "BBSWrite/BBSPrintf"
    }
  ]
}
