{
  "id": "prov.daydream.bbs-command.1",
  "claim_type": "operation-mapping",
  "operation": "bbs.command",
  "api": "daydream",
  "status": "documented",
  "summary": "DreamDoor InternalCommand invokes a DayDream internal command",
  "sources": [
    {
      "archive": "DayDreamBBSDev.lha",
      "path": "DayDream/Developer/DreamDoor/Doc/DreamDoor.doc",
      "symbol": "InternalCommand"
    },
    {
      "archive": "DayDreamBBSDev.lha",
      "path": "DayDream/Developer/DreamDoor/Sas_C/Example/FileChain.c",
      "note": "Observed SDK example usage."
    }
  ]
}
